,review_rating,review_text,verified_purchase,total_words,total_characters,total_stopwords,total_punctuations,total_uppercases,sentiment,sentiment_label
1269,5,say label wash well,True,9,43,5,1,1,0.0,neutral
1270,5,great price love fabric condition,True,6,40,1,0,2,0.65,positive
1271,5,quick postag great product,True,5,31,1,0,1,0.5666666666666667,positive
1272,5,smell anymor,True,4,21,2,1,1,0.0,neutral
1273,5,smell beauti fragranc last week wash great valu subscrib product,True,15,105,4,4,4,0.4,positive
1274,1,bin,False,2,10,0,1,2,0.0,neutral
1275,5,two week use bad cystic acn start fade time finish bottl acn gone thought miss toner skin care start use garnier one set one week later acn come back im back use simpl acn fade never stop use,False,71,342,32,3,2,-0.17499999999999996,negative
1276,1,bought coupl month ago along cleanser moisturis spot prone oili skin occasion issu dermat around eye worst mistak ever thought crazi simpl suppos gentl skin use toner dri skin bought dermat back around eye red skin flaki sore place first think toner two month elimin definit toner dri skin would recommend product,False,113,586,60,8,7,-0.1875,negative
1277,2,diabet want find carbohydr content could find nutrit inform whatsoev badli manag wall,False,22,143,8,6,7,0.0,neutral
1278,5,girl picki wash condit hair go tonn stuff teen thought would tri excel price well delight result soft stinki silki smooth hair one chemic treat hair well lead tri mine bleach tone wow spend fortun shampoo condition well think need hair great subscrib save featur save us buy price product,True,114,588,61,15,15,0.27999999999999997,positive
1279,5,smell cloth love last long dont use lot aswel would defin buy recommend other,False,25,136,12,3,1,0.08125,positive
1280,5,normal buy wash deterg shop like see offer etc run wash liquid fabric condition abl get shop due broken ankl came across bundl decid give tri desper wash stuff bundl brilliant buy good valu money would highli recommend howev fabric condition seem clog drawer though never happen normal fabric condition use,True,99,517,45,9,11,0.22916666666666666,positive
1281,5,love specif version comfort realli subtl gentl smell overpow cloth still know,True,24,140,11,3,3,0.5,positive
1282,5,convert friend tri time cannot live without realli fresh yet mild smell cloth nice remov stain messi year old,True,39,198,17,5,4,0.29393939393939394,positive
1283,5,fantast valu order sunday deliv monday thank much,True,9,69,2,4,3,0.2,positive
1284,5,smell good make cloth soft,True,8,40,3,0,0,0.39999999999999997,positive
1285,3,lotion work pretti good howev pump oz bottl csmart pump stop work design bottl screw pump like done past get last lotion determin loos entir bottl lotion cut top box knife word wise advoid smart pump,False,76,391,33,7,7,0.31071428571428567,positive
1286,2,pump design larg bottl horribl imposs determin end lotion come look pump mani carpet piec furnitur ruin pump design,False,40,215,21,3,3,0.0,neutral
1287,2,believ unscrew top get last lotion lotion bottl get wast money switch bodi lotion next purchas,False,43,208,22,9,5,0.16666666666666666,positive
1288,5,good,False,1,4,0,0,0,0.7,positive
1289,4,great soap alway love,True,4,25,0,1,1,0.65,positive
1290,5,daughter allergi could stand one,True,10,55,5,1,0,0.0,neutral
1291,5,great valu work well,True,5,27,1,1,1,0.8,positive
1292,5,fantast amazon ther,False,4,27,0,2,2,0.0,neutral
1293,5,great valu deliveri perfect anyon wash daili basi like last age cheaper buy multipl bottl supermarket smell love,True,33,180,11,5,2,0.575,positive
1294,5,lot peopl complain seal neither one buy morrison requir seal great price great product work well smell good buy,True,43,230,22,8,7,0.7666666666666666,positive
1295,5,get deliv regularli make lot easier lug heavi stuff home shop brilliant,True,22,118,8,3,2,0.9,positive
1296,5,great price fast deliveri,True,5,29,1,0,1,0.5,positive
1297,2,product deliv would soften properli tast inferior one buy tesco put pot microwav get noodl soften littl leav sever minut buy,True,48,243,26,4,5,0.0,neutral
1298,5,brilliant,True,1,9,0,0,1,0.9,positive
1299,2,much flavour pralin cheap tast textur ice cream cheap tast choc cover also tast much like dark chocol milk realli fan,False,39,201,16,3,4,0.21000000000000002,positive
1300,5,fav love alway use xxxx make hair soft n smooth,False,14,61,4,0,1,0.3333333333333333,positive
1301,5,mani use butter toast soup stew roast potato handi littl tip jar nearli empti store jar side littl flat bit side jar get last bit easili,False,50,248,23,16,1,-0.0125,negative
1302,5,love love love love flavour one favourit nice spici,False,15,79,6,3,3,0.52,positive
1303,5,love clean exfoli beauti without leav skin red sore like feel supersoft refresh use twice week keep skin look feel clean fresh,False,38,210,14,4,4,0.3066666666666667,positive
1304,5,valu great everyday use,True,5,30,1,2,2,0.30000000000000004,positive
1305,5,use deodor year find incred effect long last one use,True,21,116,10,2,4,-0.025,negative
1306,5,shampoo cheaper shop say xd,True,15,75,10,5,5,0.0,neutral
1307,4,strong expect pleasant enough realli expect realli hot would call mild,True,30,153,18,6,4,0.35,positive
1308,5,love shampoo,True,2,15,0,1,1,0.5,positive
1309,4,decent size bottl wash liquid price bad amazon offer use happi perform,False,32,159,19,2,4,-0.2666666666666666,negative
1310,5,love particular surf smell leav wash smell fresh also great price much get,False,22,116,9,2,1,0.3933333333333333,positive
1311,5,love bought daughter noth els seem work keep fresh day smell fresh clean last day,True,33,164,16,5,3,0.29333333333333333,positive
1312,5,fast deliveri true descript,True,5,33,1,0,1,0.275,positive
1313,5,buy soften smell phenomen last age wash soft great bottl pretti extrem function measur cap love,True,35,190,17,7,4,0.35,positive
1314,5,brillant get money worth last,True,7,38,2,0,1,0.15,positive
1315,5,brand go wrong wash,True,10,52,5,2,1,-0.5,negative
1316,5,,True,1,6,0,5,1,0.0,neutral
1317,5,like could buy bulk cheaper price,False,10,45,4,0,2,0.0,neutral
1318,5,great better normal dairi,False,8,43,3,2,1,0.48333333333333334,positive
1319,5,brilliant,True,1,9,0,0,1,0.9,positive
1320,5,wife extrem sensit skin never believ inadvert wash cloth differ deterg basi use either persil fairi product joint laundri mani year combin fact cannot use biolog product septic tank product ideal deterg dispens capsul insert main bodi product place top laundri suffici deterg wash two bottl deterg compliment fabric condition measur fabric compart soften wash machin suffici condit wash product pleasant clean fragranc leav cloth smell fresh soft dri realli good product sensit skin competit price normal supermarket price,False,157,947,76,15,12,0.4351851851851852,positive
1321,5,order great valu arriv state good servic,True,10,58,3,0,1,0.75,positive
1322,5,last day amaz lynx africa smell use time,True,16,80,7,2,2,0.0,neutral
1323,5,leav nice streak free clean shine smell fresh,True,11,59,3,1,1,0.4166666666666667,positive
1324,1,purchas product recent smell consist use sure product dilut guess water bit blue pigment disappoint qualiti,True,42,212,24,4,4,0.16666666666666666,positive
1325,4,decent soften bit hard make last long list number wash,True,18,88,7,1,3,-0.04375000000000001,negative
1326,5,comfort creation best round fabric condition soften market although come close product match scent soft valu money honeysuckl sandalwood person favourit howev scent would descript,True,48,298,20,8,5,0.3,positive
1327,4,good bargin,True,2,11,0,0,1,0.7,positive
1328,1,start capsul empti call persil get noth normal would get sorri voucher post noth use whole packet still happi left slimi capsul cloth mean wash first time time whole packet never problem like brand im total unhappi would recommend anyon buy even give star compani respons problem recommend buy,True,106,567,55,13,27,0.06964285714285715,positive
1329,4,kit sensit skin get x persil non biolog wash deterg potenti wash x ultra concentr comfort pure potenti wash say potenti larger load need increas amount use tend altern fairi persil non bio young children also famili member sensit skin never issu someon reaction due persil probabl prefer brand use comfort pure time member famili like leav cloth feel soft use children cloth leav nice soft product kit endors british skin foundat price kit time write review slightli would current get individu product supermarket product get deliv want give practic babi shower gift would ideal slightli differ nappi pyramid would also make practic hous warm present overal good product work slightli expens side,False,214,1266,97,40,24,0.24311224489795918,positive
1330,5,fake tan moistur honestli amaz tan ever use tri mean soft skin dri almost instantli honestli love give realli natur deep tan last age usual twice week give good exfoli week start holi grail constantli purchas,False,78,400,39,8,10,0.02968749999999999,positive
1331,3,say smell great though,True,9,50,5,2,1,0.8,positive
1332,5,love tresemm hair product shampoo great littl bit goe long way make bottl last age hair feel silki afterward smell great price fab line sale cost high street supermarket,True,44,242,15,5,5,0.36833333333333335,positive
1333,5,happi purchas,True,3,19,1,0,1,0.0,neutral
1334,5,love english mustard far better polish stuff,True,12,65,5,3,4,0.275,positive
1335,5,valu money,True,3,15,1,0,1,0.0,neutral
1336,5,strict vegetarian miss eat cornetto sinc find wernt veggi eager tri delici cant tell differ tast textur rememb normal one,False,41,224,19,6,3,0.15,positive
1337,5,everyon famili like ice cream flavour exempt tast yummi worth money stick medium size,False,29,157,13,13,2,0.3,positive
1338,5,good price product,True,5,25,1,1,1,0.7,positive
1339,5,made hair look aliv oili scent power well,True,17,87,8,3,4,0.0,neutral
1340,5,good valu buy tresem shampoo shampoo good dri hair need moisturis,True,19,104,8,2,2,0.7,positive
1341,5,love soft shampoo leav hair,True,8,41,3,0,1,0.3,positive
1342,5,happi purchas,True,3,19,1,0,1,0.0,neutral
1343,5,would buy,True,3,15,1,0,1,0.0,neutral
1344,5,daughter recommend use last two year alway comment love natur tan leg thought would tri instead usual st tropez gradual tan one use shower well glad gave natur tan also slight shimmer made leg look lot healthier consid aw smell either like fake tan use everi day use bodi polish get rid dead skin cell product seem work well way,False,127,614,67,5,13,-0.016666666666666663,negative
1345,5,absolut love smell wash alway smell fresh hope limit edit end stayer best soften use year,False,28,154,10,7,5,0.6,positive
1346,5,light fragranc leav cloth soft,True,6,39,1,1,1,0.25,positive
1347,5,great valu money light fragranc leav cloth soft,True,10,63,2,2,2,0.4333333333333334,positive
1348,5,came separ packet sealabl top scent love affect kid skin find need put fabric soften rough dri otherwis great fantast valu money,True,45,235,20,6,11,0.42500000000000004,positive
1349,1,bought bottl differ colour differ fragranc,False,18,97,11,1,1,0.0,neutral
1350,5,great ice cream rich like superior brand dairi stuff,False,14,76,5,2,2,0.625,positive
1351,5,read review strong smell check bottl current use bottl ident particularli strong smell actual like order anoth one check smell accept inde chang return,False,50,289,22,6,6,0.21666666666666665,positive
1352,1,bought offer thiught differ cojld garnier summer glow well apar made go stripey make feet orang make stink fals tan moral stori bought garnier better smell never streak,False,64,327,34,8,5,0.25,positive
1353,5,browni point round,False,4,24,1,0,1,-0.2,negative
1354,5,pleas found absolut delici ice cream soft creami love vanilla flavour hard finish tub one go,False,27,146,11,3,3,0.10277777777777776,positive
1355,4,vfm,True,1,3,0,0,3,0.0,neutral
1356,5,good buy,True,3,13,1,0,1,0.7,positive
1357,5,great snack love drink juic noodl gone make bread butter noodl sandwich yum lol,False,23,123,8,3,1,0.7000000000000001,positive
1358,1,bland beef tomato flavour sachet wateri cheap sauc dont recal bad ive beef one n thick tasti wont buy,False,34,176,14,6,0,-0.19166666666666662,negative
1359,5,time favourit soften u never smelt anyth nice last long time happi custom,False,20,115,7,1,2,0.18333333333333332,positive
1360,5,work well,True,2,11,0,1,1,0.0,neutral
1361,5,tast better brand,True,6,34,3,0,1,0.5,positive
1362,5,love smell,True,3,15,1,0,1,0.5,positive
1363,5,realli last longer much cheaper end,False,10,50,4,0,1,0.1,positive
1364,5,quick deliveri good valu money leav cloth smell clean fresh,True,12,75,2,1,2,0.425,positive
1365,5,exactli expect occasion use pod larger load slightli cheaper per pod supermarket,True,19,118,5,3,4,0.0,neutral
1366,1,felt like water close receiv fact like realli poor product buy,True,26,129,13,3,5,-0.4,negative
1367,5,purchas sport mad teenag daughter want deodor would last end day product exactli promis scent also amaz,True,33,182,16,1,1,-0.3125,negative
1368,5,allergi product one good us,True,12,59,7,1,1,0.7,positive
1369,5,love,True,2,11,1,0,1,0.5,positive
1370,5,love cleans lotion thick gentl skin superdrug fantast price deal even better,False,22,124,10,3,2,0.2333333333333333,positive
1371,1,buy simpl product chang preserv come bad sore rash eye burn top lip tingl wash phone simpl told product chang stuff chang preserv ask said know chang want know good reason except mayb save money use cheaper ingredi use simpl product nearli year sinc nivea sold compani german compani chang product im realli angri suppos use sensit skin simpl ok rubbish im skin sore burnt simpl care pleas care usual stock product offer fulli asda gave refund onto gift card receipt bottl well pocket,False,200,1012,107,27,32,0.125,positive
1372,5,perfect realli creat perfect fruit cream balanc lolli love fact cream foami rest vanilla ice cream flavour,False,31,172,15,3,3,0.8333333333333334,positive
1373,5,absolut delici son favourit,False,5,39,1,1,2,0.0,neutral
1374,4,one star remov piec crack,False,11,53,5,1,1,0.0,neutral
1375,3,bought today mother ban tan hous thought could sneaki purchas moisturis tan one appli seem bit sticki thought would sink bit time woke morn tan sunk still felt tacki colour tan realli natur give healthi glow smell easi last minut night,False,87,425,46,9,7,0.0,neutral
1376,5,great buy,True,2,9,0,0,1,0.8,positive
1377,5,good price,True,2,10,0,0,1,0.7,positive
1378,5,thank god somebodi deliv brazil make expat live bearabl thank,True,14,88,3,6,4,0.13636363636363635,positive
1379,1,like wipe scratchi skin gentl would recommend wipe rip apart easili use,True,25,131,11,5,7,0.0,neutral
1380,5,ok,True,1,2,0,0,1,0.5,positive
1381,5,good buy,True,2,8,0,0,1,0.7,positive
1382,5,realli dri patch forehead cheek month tri load differ expens product none work use scrub got rid made skin smooth good scrub dri flaki skin face,False,52,257,26,3,4,0.55,positive
1383,1,favourit deodor use year bought new realis chang fragranc hate aw need find new deodor,False,37,191,20,9,5,-0.17575757575757578,negative
1384,5,great product nice smell job well,True,10,51,3,3,2,0.7,positive
1385,5,product smelt great made cloth smell fresh howev price cheaper tesco wilkinson,False,19,114,7,1,3,0.55,positive
1386,5,go wrong price often use alongsid fake tan sustain colour skin often get dri appli fake tan help keep hydrat quick easi appli appli either morn night leav see result quickli good take away holiday give extra summer glow colour easi howev finish appli make sure wash hand wipe palm wet wipe also clean nail thoroughli colour stick use hand appli realli recommend product good valu money,False,129,683,57,21,8,0.09999999999999999,positive
1387,5,good,True,2,8,1,0,1,0.7,positive
1388,5,love noodl,True,4,21,2,1,1,0.5,positive
1389,5,got hope reduc smell mice everi load consist continu work,True,30,146,18,3,3,0.0,neutral
1390,5,love scent excel valu money,True,7,42,2,0,1,0.5,positive
1391,5,nice deodor last age smell overpow,False,8,53,2,0,1,0.3,positive
1392,5,like smell fresh clean,True,5,24,0,1,1,0.33333333333333337,positive
1393,5,absolut great valu amazon ideal snack warm cook fast deliveri,True,18,98,7,3,3,0.6250000000000001,positive
1394,3,first time bought ice cream review good tri honest bad amaz vanilla yogurt alpro way better kid enjoy need vanilla flavour husband smell say smell like big blop cream,False,59,298,27,7,7,0.25,positive
1395,1,previou review purchas offer sure formula chang streaki orang see streak dri would buy search better product,False,34,194,16,6,4,0.5,positive
1396,5,verri happi comfort time thank much,True,18,81,12,0,1,0.2,positive
1397,5,caught sudden nice weather still pale uncook chip bought bottl tri first time use coupl streak leg read instruct realis say must appli circl next day use liber amount made sure use circular motion delight second day enough colour go bare leg also cover streak appli day run look like away week sun realli natur even colour bit whiff fake tan first appli wear hour skin feel smooth moisturis ad bonu,False,167,798,93,10,14,0.11166666666666669,positive
1398,5,alway long healthi colour skin extrem pale put time use tan product well disastr howev first success product use creat beauti even healthi natur tan within day could rate enough also sensit spot prone skin face abl use face success well long last deepli moisturis super natur favourit,False,98,550,47,20,9,0.09703703703703703,positive
1399,5,ive use product day natur tan easi appli like better bondi sand gradual tan slight fake tan smell first wear away pleas,False,46,226,21,4,5,0.020833333333333343,positive
1400,5,use everyday month great love simpl wipe anyway one great remov make leav skin feel refresh definit buy review collect part promot,False,48,258,24,3,4,0.47500000000000003,positive
1401,5,put everi night go bed wake morn skin feel hydrat plump love sensit skin struggl eczema throughout life cream never caus problem love,False,54,261,28,4,6,0.5,positive
1402,5,perfect gentl product focus hydrat tacki also import goe everi cream highli recommend,False,29,158,12,9,3,1.0,positive
1403,5,friend told dove month back recommend particular one see though make skin beauti soft smell devin honestli live without alway buy scent signatur haha nice see offer buy nearli go saver instead get normal overal buy smell pamper love bath get scent dove bubbl bath heheh enjoy,False,104,532,48,20,15,0.2503367003367003,positive
1404,5,favorit afford bodi wash super moistur doesnt leav bad residu scent fresh highli recommend,False,23,142,9,5,3,-0.02222222222222218,negative
1405,5,go bodi wash leav skin feel super soft doesnt irrit sensit skin harsh perfum chemic continu use product everi shower bath also pretti inexpens,False,36,212,12,3,4,0.07777777777777778,positive
1406,5,smell great realli help moistur skin realli soft smooth skin,False,19,100,9,2,2,0.43333333333333335,positive
1407,5,bodi wash help dri skin get realli bad red bump dryness help tremend smell amaz leav skin feel smooth silki buy anoth bodi wash,False,41,215,17,4,2,-0.09999999999999994,negative
1408,4,soap love scent plenti would prefer longer last scent bodi comparison product overal would recommend,False,29,166,14,2,3,0.25,positive
1409,5,recommend anyon dri skin doesnt like feel oili skin soft glow afford,False,26,135,14,3,3,0.1,positive
1410,4,moistur nice thick consist smooth soft skin smell amaz long last clean,False,16,105,4,4,3,0.15952380952380954,positive
1411,5,smell wonder light clean scent leav skin feel moistur smooth bodi wash use go afford would continu recommend friend famili,False,41,220,20,6,6,0.3888888888888889,positive
1412,5,tri fake tan best far look natur amaz,False,15,75,6,2,1,0.19999999999999998,positive
1413,4,quit fair skin hard find product make go streaki look like spray orang juic well appli week skin look feel amaz mani comment nice colour skin went back bought bottl today reason give star develop smell bit strong smell like cook haha get amaz result happi highli recommend,False,104,521,51,8,10,0.2736111111111111,positive
1414,4,purchas week ago use time second applic alreadi nice subtl tan expect work quick would say get dispos glove even wash hand straight away notic odd mark hand,False,46,248,17,1,3,0.19333333333333333,positive
1415,5,bought long ago special offer expect much rare lotion give desir effect howev one absolut perfect tan effect natur blotch patch gorgeou brown colour recommend,False,45,255,18,6,3,0.4017857142857143,positive
1416,2,bought fair hide sunshin howev product felt good moistur howev felt clingi greazi minut hour wait cream remain sticki also chang skin colour realli disappoint advis buy product,False,56,305,27,6,7,0.7,positive
1417,2,purchas offer blindingli white leg need bit help want gradual tanner less chanc obviou streak smelt nice applic light floral scent howev within hour smelt stronger actual full fake tan unpleas could also feel cream sit skin fulli absorb dri actual tan result bare notic buy,False,83,458,35,11,7,0.08148148148148149,positive
1418,5,love fair hair blue eye lili white skin older ladi burn crisp sun uncov return holiday want least look like tan cold bought offer went fair med first time put arm sparingli didnt realli notic much although defin someth today thought let add bit usual morn shower appli bit liber arm leg face comment today love glow develop nice today sassi look healthi bod feel good bought anoth tube order whilst offer hate sit sun burn unless cover p lotion safe way get bronz look streak easi appli doesnt stain hand slight tan smell much hook,False,191,948,91,24,17,0.16578947368421051,positive
1419,4,realli like light colour product give easi use streak free howev read lot review mani claim lotion dri quickli howev experi spend hour dri sticki day,False,46,246,19,6,3,0.4,positive
1420,5,husband like dove extra fresh nice fresh clean smell,False,12,65,3,2,12,0.31333333333333335,positive
1421,5,start use product month ago stop sweat stay dri day first time sweat control year confid return great tri product give day kick,False,48,248,22,8,7,0.525,positive
1422,5,final found deodor menopaus women,False,8,51,3,1,1,0.0,neutral
1423,5,realli clean fresh smell fragranc absolut last day long x kept wonder fresh dri x love dove product x especi bodi wash deodor x,False,36,196,12,0,2,0.23611111111111113,positive
1424,5,look good face spf long especi weather start improv alway found expensic happi inexpens oili skin make greasi look amaz makeup makeup look much better foundat goe smoothli pore hardli visibl love love love realli mositur good sun protect,False,89,460,46,9,7,0.47857142857142854,positive
1425,5,start use cerav facial lotion month ago sinc constant breakout norm want love product persist recent decid enough enough pick simpl one best thing done within two day current spot begun clear overal look face much calmer goe show fanci long name sciencey product alway come top simpl gentl product like one,False,98,528,44,14,10,0.1875,positive
1426,5,amaz cant rate enough got gift stop smell scent absolut amaz exfoli amaz skin use feel soft stop use wont use skin brand x,False,42,228,18,5,0,0.05,positive
1427,5,realli enjoy use product compar favour expens brand,False,14,97,5,2,1,0.4,positive
1428,5,alway use differ brand gradual ran smell alway put half price enough point use thought would give tri smell love skin soft goe well use like moisturis wash palm wipe look amaz use rather usual st moritz natur look quit pale found applic medium dark perfect last quit day notic start disappear quit subtli great product must buy,False,115,605,51,37,54,0.16233333333333336,positive
1429,5,love dove bath product soap bar dove scent quarter moisturis dri soap,False,22,120,9,5,3,0.5,positive
1430,5,nice fresh fabric soften,True,4,27,0,0,1,0.44999999999999996,positive
1431,5,product amaz valu money smell love soft job well would recommend purchas,False,22,123,10,3,3,0.3,positive
1432,5,great product thank,True,3,20,0,0,1,0.8,positive
1433,4,happi,True,1,5,0,0,1,0.0,neutral
1434,5,okay hair like us sure less year meant care bit right probabl best shampoo ever own need buy like bottl year feel good got condition equal good bought size,True,67,319,33,9,5,0.45767195767195773,positive
1435,1,gave everyon gave pack rash spot,True,13,54,7,0,2,0.0,neutral
1436,4,great fragranc strike right balanc although wife complain small bottl difficult pour accur probabl slurp reckon full measur fact nearer two full measur realli quick way use small ml bottl use cap measur suppos find econom way use condition cool fragranc actual carri cloth make smell like fresh sky know thing smell like someth els realli like condition bottl made recycl plastic manufactur ask custom recycl new bottl go path third time around three star product anoth one good green,False,170,906,81,14,14,0.16036075036075037,positive
1437,4,great price bottl need small amount half cap wash soften cloth smell nice last want someth linger tri lenor unstopp soften cloth said soften effect notic even handwash delic underwear like ultra concentr reduc size bottl storag,False,69,407,30,15,6,0.19666666666666668,positive
1438,5,ultra concentr fabric condition initi surpris small bottl read side need half cap product bottl last nice abl fit bottl kitchen cupboard find half cap enough live area hard water cloth came wash feel soft smell love realli like scent although noth special gener floral fabric condition scent,False,111,567,60,8,7,0.1015422077922078,positive
1439,1,bought one smaller size bottl soften compar qualiti disappoint find much thinner kind find shop heavili dilut real save go back get shop cancel subscript,True,53,287,28,3,2,0.2,positive
1440,5,buy time problem item,True,9,42,5,0,1,0.0,neutral
1441,5,perfect tast salti flavour yeast base product buy today honest love toast,False,21,117,9,4,3,0.32499999999999996,positive
1442,5,love pot noodl plenti curri flavour brill snack anytim easi prepar great valu money cheaper supermarket definit recommend,True,26,161,8,6,7,0.65,positive
