,review_rating,review_text,verified_purchase,total_words,total_characters,total_stopwords,total_punctuations,total_uppercases,sentiment,sentiment_label
770,4,use long pleas overpow smell tight leav face oili would definit recommend one best thing happen face review collect part promot,False,52,273,28,8,5,0.2571428571428571,positive
771,3,use face felt love soft cool felt refresh readi go fight day even woke feel tire drawn help love smell easi use even child use far see differ face review collect part promot,False,71,333,37,4,5,0.31,positive
772,5,use face wash last coupl day morn even part cleans routin realli quit like leav skin quickli react differ cleanser toner seem less harsh facial wash skin feel almost moisturis towel dri smell delici delic scent soapi review collect part promot,False,81,447,36,10,5,-0.09166666666666667,negative
773,5,use cleanser twice day combin skin realli effect harmoni skin unlik cleanser dri skin effect clean readi toner would highli recommend harm colour addit review collect part promot,False,55,314,26,10,7,0.3666666666666667,positive
774,5,use face wash day found skin feel softer touch skin look clearer brighter feel much cleaner afterward would definit recommend everyon review collect part promot,False,47,264,19,9,5,0.2,positive
775,5,amaz product would highli recommend buy make skin feel smooth use use small amount time mean last longer review collect part promot,False,48,260,24,8,5,-0.040624999999999994,negative
776,4,like face wash gentl skin left skin feel love smooth use cleans feel got makeup im give star anoth great product simpl review collect part promot,False,56,284,28,8,4,0.42500000000000004,positive
777,4,usual go high street product spent mani year design skincar howev surpris clean skin felt use simpl facial wash neg take eye make easili design face wash price afford expect review collect part promot,False,74,391,38,8,6,0.03533333333333334,positive
778,5,use product leav skin feel soft use everi day feel like constant glow love product continu use everyday part routin review collect part promot,False,54,263,29,5,5,0.09999999999999999,positive
779,5,use product week good skin cleanser seem dri skin gentl love way make skin feel keep feel refresh day review collect part promot,False,59,283,34,7,2,0.6,positive
780,3,wipe love fragranc ok job take makeup howev wear light coverag foundat think wear fuller coverag may differ stori also slightli dri side feel great take makeup bad quickli take light coverag makeup review collect part promot,False,80,418,39,9,6,0.3166666666666667,positive
781,4,tri wipe instead usual one last week remov makeup well leav face feel dri would good slightli thicker good consid price would buy review collect part promot,False,51,282,20,7,3,0.2875,positive
782,5,reciev wipe coupl day ago havent stop use sinc dri easili lot product wipe leav face smooth would buy review collect part promot,False,51,253,26,8,4,0.4,positive
783,5,went away weekend decid use wet wipe think amaz wipe great size remov make includ mascara face feel sore look red great review collect part promot,False,54,278,25,8,5,0.375,positive
784,5,reviv product week ago usual use complet differ make make wipe fallen love one deffinalti purchas dri sensit skin one issu use usual struggl fond make leav reaction face review collect part promot,False,73,398,35,6,6,0.0,neutral
785,4,nice product colour packag smell nice took makeup easili got still use face wash get rid bit makeup face dri kept moistur well drawback wipe includ week worth less includ least month suppli review collect part promot,False,76,414,33,13,7,0.20666666666666664,positive
786,4,simpl micellar wipe limit addit littl mix wipe seem alright use howev easi use previou wipe past like babi wipe seem easier wipe makeup packag beauti go lie use get makeup hand eye foundat gotta scrub would nice smell know say artifici perfum someth els would nice state wipe dont contain alcohol howev back small write see say use cetearyl alcohol still form alcohol apart would use need reccomend product okay product buy review collect part promot,False,141,759,58,18,15,0.19999999999999998,positive
787,5,use comfort sunshini day also smell amaz seen thought would tri chang beauti smell gorgeou never smelt anyth good think stick cloth love soft make whole hous smell love cloth dri,False,59,318,26,1,4,0.4,positive
788,5,love,True,2,7,1,0,1,0.5,positive
789,5,excel product left skin feel clean healthi great valu money definit use forese futur tri similar product past gotten result good review collect part promot,False,55,306,26,10,3,0.26944444444444443,positive
790,5,suppos effect remov trace makeup gentl sensit skin buy want good standard toner fanci extra good basic product clean skin well even maskara remain gentl skin irrit sticki feel use defin worth price review collect part promot,False,68,388,29,10,7,0.2952380952380952,positive
791,5,got around week ago tri usual morn routin realli impress skin feel look great chemic smell oili feel buy reccomend friend famili sure deliveri quick arriv damag great qualiti review collect part promot,False,59,333,25,13,2,0.4366666666666667,positive
792,5,toner great skin alcohol free kind skin love use morn night clean impur also calm skin whitout itch wonder product happi discov look forward use daili review collect part promot,False,63,346,32,12,6,0.49444444444444446,positive
793,5,love toner use everi day sinc get definit buy make skin feel soft makeup goe nice use strong smell like toner use leav skin feel extrem tight mostli enjoy toner sensit skin react lot skincar product lucki caus reaction review collect part promot,False,93,491,46,13,10,0.30912698412698414,positive
794,5,happi result product kind skin left skin feel smooth clean light skin oili perfect alreadi oili skin definit recommend amaz product review collect part promot,False,48,274,24,9,5,0.4611111111111111,positive
795,5,sooth facial toner love product remov residu left behind cleans also love cool feel skin remov residu ad bonu leav skin clean clear readi moisturis work magic review collect part promot,False,58,320,26,5,6,0.21296296296296297,positive
796,5,happi receiv product work well skin made spot blemish disappear face feel lot smoother use product love neutral smell harsh face like product review collect part promot,False,64,327,34,8,4,0.15,positive
797,2,quit dri skin face toner help dryness felt dri skin even left face feel tight overal unpleas mayb certain skin type might better review collect part promot,False,57,295,28,8,4,0.13392857142857142,positive
798,5,best thing tri skin feel smooth refresh love believ never use part daili routin absolut love would definit recommend everyon want feel refresh review collect part promot,False,58,308,29,5,6,0.6,positive
799,4,gentl skin make feel smooth soft make skin feel tight like toner smell nice use day morn job effect review collect part promot,False,52,263,26,9,5,0.23035714285714284,positive
800,5,alway fan simpl product let brand gentl sensit skin left skin feel hydrat refresh would defiantli recommend defiantli repurchas product finish review collect part promot,False,55,312,26,8,6,0.0,neutral
801,5,realli impress toner tri mani past agre sensit skin howev love gentl skin appli skin feel tighter smooth import part daili skin routin review collect part promot,False,59,315,29,10,6,0.21666666666666667,positive
802,5,im glad went back toner id use micellar water irrit skin start use simpl toner skin back normal gentl skin ive use shall buy review collect part promot,False,59,290,30,5,6,0.1625,positive
803,5,bought wipe help clean face take make end night good take make need wipe wake whole face make face felt clean use wipe dri skin review collect part promot,False,67,319,35,7,4,0.4083333333333333,positive
804,4,nice product colour packag smell nice took makeup easili got still use face wash get rid bit makeup face dri kept moistur well drawback wipe includ week worth less includ least month suppli review collect part promot,False,76,405,33,16,7,0.20666666666666664,positive
805,5,went away weekend decid use wet wipe think amaz wipe great size remov make includ mascara face feel sore look red great review collect part promot,False,54,275,26,9,5,0.375,positive
806,5,reviv product week ago usual use complet differ make make wipe fallen love one deffinalti purchas dri sensit skin one issu use usual struggl fond make leav reaction face review collect part promot,False,73,392,37,8,6,0.0,neutral
807,4,tri wipe instead usual one last week remov makeup well leav face feel dri would good slightli thicker good consid price would buy review collect part promot,False,51,279,21,8,3,0.2875,positive
808,5,love dove soap bar liquid soap amaz lather great alway leav feel super clean even smell soap leav shower love alway leav skin feel great,False,47,237,22,6,7,0.5499999999999999,positive
809,5,love bodi wash dove line favourit one realli like heavi scent realli leav skin soft moistur nourish feel buy one frequent,False,39,207,18,6,3,0.2333333333333333,positive
810,2,big fan dove doesnt much wow factor feel clean use base commerci cant help feel disappoint especi price point dont recommend,False,38,203,16,8,8,-0.08333333333333334,negative
811,5,skin soft one wash stuff crazi like oili dri either actual moistur lot first time buy happi use shave skin never felt better,False,47,227,24,5,8,0.2125,positive
812,4,use bodi wash recent work great skin moistur pretti decent price,False,17,99,6,2,2,0.32222222222222224,positive
813,5,love bodi soap like appli lotion shower realli dri skin skin want act dri reli soap give extra hydrat smell nice keep skin moistur,False,49,239,25,4,4,0.3666666666666667,positive
814,4,moistur pretti scent well keep skin moistur day long,False,20,102,11,2,3,-0.05,negative
815,3,pretti good bodi wash cost friendli plu get job done,False,18,83,8,2,4,0.7,positive
816,5,buy n month n alway come back also clear whitehead definit say chang anoth,False,35,173,18,5,9,0.05000000000000001,positive
817,5,lot better wet roll on spray deodor,True,10,50,3,0,1,0.2,positive
818,5,love similar luxuri scent,False,6,38,2,1,0,0.25,positive
819,4,actual work streak littl,False,8,44,4,2,1,0.0,neutral
820,5,rich tasti beefi love put stew,False,13,65,7,3,3,0.4375,positive
821,1,tast noth shame use buy noth els anymor,False,14,74,6,4,4,0.0,neutral
822,4,face wash left face feel realli clean fresh easi use easi wash also smell realli nice definetley use recommend friend famili review collect part promot,False,55,279,27,6,4,0.31666666666666665,positive
823,4,realli great product impress far effect feel light skin quit sensit skin great would defo buy packag usual simpl product clear direct review collect part promot,False,57,307,27,5,6,0.29285714285714287,positive
824,5,love simpl product combin skin simpl product never caus breakout kind skin face wash refresh use part morn routin leav skin feel cleans fresh review collect part promot,False,56,302,27,7,6,0.46666666666666673,positive
825,5,love face wash like simpl product gentl skin caus reaction red howev unlik product sensit skin actual manag work well time found also remov makeup well particularli stubborn eye makeup review collect part promot,False,62,353,26,10,5,0.16666666666666666,positive
826,4,fine exactli say tin love free perfum paragon gentl remov make like champ use shower save time found make skin feel tight win skin feel particularli refresh fine job review collect part promot,False,73,394,33,13,6,0.39246031746031745,positive
827,5,use facial wash skin felt extrem clean fresh realli deep clean face made skin love soft facial wash contain harsh chemic great realli nice skin lather realli nice wash easili fantast price job realli well review collect part promot,False,71,390,31,9,2,0.28611111111111115,positive
828,5,came across articl use vaselin acn scar irrit skin tri never would think would think would clog pore howev opposit use month life chang scar visibl fade gone mani dermatologist find product work well game changer friend pleas tri,False,86,439,43,10,11,-0.4,negative
829,5,love simpl rang textur wipe realli pleas take makeup great face feel clean moistur use ad partnership littl mix great daughter encourag use defin buy review collect part promot,False,57,322,23,10,9,0.6166666666666667,positive
830,5,alway apprehens buy wipe break easili broken past week use also take makeup without irrit skin one wipe also goe long way ever need one cleans face combin skin target dri skin also help oili area review collect part promot,False,84,421,41,8,13,-0.23333333333333336,negative
831,5,use wipe twice day coupl day use remov make everi even also freshen bit morn wipe soft thick left skin feel mostiris took make easili even water proof mascara struggl use make set spray love wipe would recommend buy review collect part promot,False,87,450,41,12,10,0.07499999999999998,positive
832,5,arriv last week use even daili realli impress easili lift makeup leav skin feel take lot lift make spend hour scrub away would highli recommend first time woken without small mascara reiment smudg eye review collect part promot,False,73,402,31,12,6,0.0,neutral
833,5,problem makeup wipe recent pregnant skin becom sensit leav bright red rash remov makeup tri number differ wipe first use left skin sting red remov makeup left skin feel great review collect part promot,False,79,413,44,6,6,0.2314814814814815,positive
834,5,fresh cleans make wipe leav skin feel clean lightli moisturis quicker face wash feel harm skin soap product wipe stay fresh packet long period time review collect part promot,False,52,290,21,6,4,0.22916666666666669,positive
835,4,use alot tone product like cold wet immedi feel skin also skin prone blemish product realli impress toner mild gentl skin claim refresh get well absorb skin clear remain makeup left cleans use night cream serum honestli say toner contribut much cleaner finish daili regim review collect part promot,False,109,561,56,10,9,-0.0111111111111111,negative
836,4,tri week absolut fallen love remov dirt make face make skin feel sticki dri mani toner use everi even part routin wont stop review collect part promot,False,63,312,31,9,4,0.5,positive
837,4,toner moisturis someon dri skin realli benefici skin also sensit lot product caus problem howev harsh caus irrit therefor product would recommend other dri skin need toner moisturis gentl review collect part promot,False,70,397,35,6,5,-0.1625,negative
838,4,like use toner everi morn one perfect one bought month ago let skin fresh clean start new day tri disappoint alway enjoy simpl product well review collect part promot,False,60,286,26,9,6,0.4406060606060606,positive
839,5,usual fan wipe remov makeup properli even gone face time howev wipe brilliant use one wipe remov makeup includ waterproof mascara may micellar water realli good break make face feel sticki sore convert recommend review collect part promot,False,87,488,36,13,10,0.45,positive
840,5,long stand popular ice cream sweet great chocol tast yummi marshmallow throughout forget chocol fish hidden away hard put open,False,34,199,12,5,3,0.17738095238095236,positive
841,3,happi toner ad fragranc good senstiv skin yet still job also happi contain witch hazel someth usual hard find ingredi simpl clear job expect good result product review collect part promot,False,63,343,27,12,6,0.19166666666666665,positive
842,4,like use toner everi morn one perfect one bought month ago let skin fresh clean start new day tri disappoint alway enjoy simpl product well review collect part promot,False,60,283,27,10,6,0.4406060606060606,positive
843,4,product amaz make skin feel tone soft buy product give face deep clean also defo recommend friend famili also feel benefit product review collect part promot,False,55,284,27,6,5,0.15555555555555556,positive
844,4,toner moisturis someon dri skin realli benefici skin also sensit lot product caus problem howev harsh caus irrit therefor product would recommend other dri skin need toner moisturis gentl review collect part promot,False,70,394,36,7,5,-0.1625,negative
845,4,use alot tone product like cold wet immedi feel skin also skin prone blemish product realli impress toner mild gentl skin claim refresh get well absorb skin clear remain makeup left cleans use night cream serum honestli say toner contribut much cleaner finish daili regim review collect part promot,False,109,558,57,11,9,-0.0111111111111111,negative
846,5,ask tri use past month usual use bodi lotion occasion elbow knee etc one smell nice easi appli use everi day goe easili littl residu leav love smooth finish scent bottl last age good definit buy futur review collect part promot,False,85,429,42,8,8,0.24285714285714285,positive
847,5,use wipe twice day coupl day use remov make everi even also freshen bit morn wipe soft thick left skin feel mostiris took make easili even water proof mascara struggl use make set spray love wipe would recommend buy review collect part promot,False,87,447,42,13,10,0.07499999999999998,positive
848,5,fresh cleans make wipe leav skin feel clean lightli moisturis quicker face wash feel harm skin soap product wipe stay fresh packet long period time review collect part promot,False,52,287,22,7,4,0.22916666666666669,positive
849,5,usual fan wipe remov makeup properli even gone face time howev wipe brilliant use one wipe remov makeup includ waterproof mascara may micellar water realli good break make face feel sticki sore convert recommend review collect part promot,False,87,467,40,20,10,0.45,positive
850,4,realli great product impress far effect feel light skin quit sensit skin great would defo buy packag usual simpl product clear direct review collect part promot,False,57,301,28,7,6,0.29285714285714287,positive
851,4,fine exactli say tin love free perfum paragon gentl remov make like champ use shower save time found make skin feel tight win skin feel particularli refresh fine job review collect part promot,False,73,376,39,19,6,0.39246031746031745,positive
852,5,love face wash like simpl product gentl skin caus reaction red howev unlik product sensit skin actual manag work well time found also remov makeup well particularli stubborn eye makeup review collect part promot,False,62,350,26,11,5,0.16666666666666666,positive
853,4,use wipe year great recent bought biodegrad one thought biodegrad someth think guy,False,31,188,17,10,9,0.4,positive
854,5,best shop bought mayo,False,5,26,1,1,1,1.0,positive
855,5,good stuff happi,True,3,17,0,1,1,0.7,positive
856,5,surf tropic lili ylang ylang fab laundri deterg awesom smell brilliant clean power get cloth bright clean fresh even cold wash love make thing smell last time great clean power gener stain like tea deodor mark mud spag bol great famili realli easi store use often rub littl cloth particular stain like spag bol case need littl attent work wonder even white realli great valu use delic lingeri cotton towel silk dress man made fiber cloth like work cloth complaint gener wash highli recommend,True,124,717,37,19,12,0.34444444444444444,positive
857,4,great soften good valu price paid,True,9,47,3,0,2,0.75,positive
858,1,hate hate hate new pump seem way separ bottl order get last lotion plu new pump open big clog continu vaselin fix find new brand year loyalti one shame vaselin fix someth never broken get custom purchas new bottl sooner,False,82,414,40,12,20,-0.15041322314049593,negative
859,3,happi toner ad fragranc good senstiv skin yet still job also happi contain witch hazel someth usual hard find ingredi simpl clear job expect good result product review collect part promot,False,63,349,27,10,6,0.19166666666666665,positive
860,5,go wrong product,True,7,36,3,1,1,-0.5,negative
861,1,comfort blue sky miss order arriv must split box soak smelt condition box open,True,28,142,14,0,0,0.0,neutral
862,5,item state deliv time also good price,True,11,55,4,1,2,0.7,positive
863,5,describ,True,2,12,1,0,0,0.0,neutral
864,5,long stand famili favourit decent ice cream yummi bit suit everyon tast delici sugari treat,False,20,119,5,2,3,0.05833333333333333,positive
865,5,ok,True,1,2,0,0,1,0.5,positive
866,5,beauti smell condition although smaller bottl normal buy continu buy ye could say concentr howev drawer wash machin auto deterg condition type depend weight wash load definit recommend,True,47,294,17,4,8,0.075,positive
867,5,sinc combin oili skin never found perfect moisturis quit particular moisturis like leav greasi feel skin appli take age soak make break thank one skin glowi definit feel hydrat smooth sinc start use month ago love much repurchas go moisturis seen mani other like much higher price tag good find,False,112,583,56,14,14,0.38645833333333335,positive
868,4,good toner everyday use use morn even make skin feel realli fresh smell soft skin right want get rid spot etc everyday toner would recommend review collect part promot,False,59,293,29,8,4,0.16428571428571426,positive
869,5,first toner use skincar routin realli impress well clean skin make feel realli refresh clean gentl skin neutral scent would defiantli purchas afterward review collect part promot,False,60,324,32,7,6,0.3277777777777778,positive
870,5,work well made differ skin quickli reduc pore within week made skin smooth would highli recommend buy cheaper product market defiantli worth buy review collect part promot,False,50,274,20,8,5,0.35,positive
871,4,toner great everi skin type opinion product plastic bottl travel friendli downsid hole pour often end use much good thing alcohol also artifici perfum colour natur best skin review collect part promot,False,83,419,49,12,8,0.8333333333333334,positive
872,5,happi found someth work skin combin skin care put realli happi facial wash sometim come hive aggrav go skin type review collect part promot,False,66,330,38,8,9,0.0,neutral
873,5,brilliant price subscrib save constant order one best shampoo ever definit recommend product especi subscrib save,True,26,166,10,4,3,0.6333333333333333,positive
874,5,love fragranc anti persdper bodi spray work reorder good valu money,True,17,100,5,3,2,0.6,positive
875,5,nice smell price cheap,True,6,30,2,1,1,0.5,positive
876,5,love product importantli fantast smell buy shower gel time,True,17,97,8,3,2,0.5,positive
877,5,kid grown up love ice cream what like,False,12,59,4,3,2,0.5,positive
878,4,ben jerri ice cream never fail favourit deliv flavour,False,15,78,6,1,2,0.25,positive
879,5,ice cream indulg fantast treat son love addit chocol fish add littl bite,False,25,129,12,2,1,0.5,positive
880,5,yummi buy treat worth,False,12,51,7,2,1,0.3,positive
881,5,good valu,True,2,10,0,0,1,0.7,positive
882,5,realli good price,True,3,17,0,0,1,0.7,positive
883,5,leav cloth smell love feel soft good price,True,10,64,1,2,2,0.4333333333333333,positive
884,5,excel product price servic fault way,True,12,67,5,3,1,0.0,neutral
885,5,great bargain bottl seem tini realli need lot soft beauti scent cloth batgain,False,20,119,7,3,3,0.45,positive
886,5,absolut love comfort love smell love everyth absolut fab round,True,17,104,6,8,1,0.325,positive
887,5,favourit condition like way smell,False,10,59,5,2,2,0.0,neutral
888,4,love fragranc item came well packag arriv promptli,True,12,72,4,1,1,0.5,positive
889,5,cloth smell love fabric beauti soft fresh smell last day cloth,True,18,99,7,2,2,0.22499999999999998,positive
890,4,friend recommend sever wash hardli see differ ad good thing plenti mani wash,True,28,150,12,7,4,0.7,positive
891,4,great wash capsul,True,3,23,0,1,1,0.8,positive
892,3,great offer superdrug howev look like st ive chang ingredi product effect rememb particular textur consist smell differ need bring back old product,False,47,261,23,5,6,0.26666666666666666,positive
893,4,leav sever damag hair moisturis fluffi ask anymor consid alreadi amaz valu money price,False,21,142,6,2,2,0.0,neutral
894,5,discov amaz product year ago sinc becom stapl mine love usag skin feel tan enough much softer shimmeri well could recommend,False,39,208,16,4,3,0.2333333333333333,positive
895,5,great product moisturis use sensit skin,False,12,68,6,3,2,0.8,positive
896,5,eczema acn rosacea face use coz dri skin product sting face make wors make skin nice soft effect help eczema,False,47,222,26,1,2,0.35,positive
897,5,oili combin skin type forev get spot blackhead zone especi nose fed start cleans tone moisturis toner far best one ever use smell amaz irrit skin like brand tri despit sensit skin blackhead spot clear oili zone much problem anymor definit get recommend anyon similar issu review collect part promot,False,114,629,58,15,13,0.28,positive
898,5,use product day say realli kind skin bad smell skin feel smooth soft use truli recommend product everyon review collect part promot,False,50,270,24,7,5,0.10000000000000003,positive
899,5,product realli surpris leav face look feel smooth soft fresh realli gentl product feel amaz massag wet skin rins without leav residu fantast valu money would certainli recommend product part everi day skin care routin review collect part promot,False,69,398,29,9,6,0.17500000000000002,positive
900,5,alway buy product realli creami irrit skin,False,14,75,7,2,2,0.0,neutral
901,4,bought someon els shop person comment use alway use simpl wash face scrub say dri skin,False,35,189,15,4,3,0.0,neutral
902,4,sensit skin usual difficult find facial wash effect refresh gentl dri skin tick box skin left feel clean fresh definit buy simpl product review collect part promot,False,54,314,25,10,5,-0.013888888888888886,negative
903,5,suffer mild ezyema skin alway sensit dri care use skincar product prefer brand use nasti fan simpl use moisturis face wipe switch use kind skin face wash week notic skin radiant less dri face left feel clean fresh wash light refresh non perfum best kind skin still cleans great everi day mild cleanser introduc skin care regim great product afford price rang review collect part promot,False,131,725,57,14,10,0.4472222222222222,positive
