,review_rating,review_text,verified_purchase,total_words,total_characters,total_stopwords,total_punctuations,total_uppercases,sentiment,sentiment_label
0,5,get older know like suitabl bodi like dove product give fresh wide awak feel dandruff flakey skin smelli pit,True,39,202,19,7,5,0.12222222222222223,positive
1,5,three gigant marmit jar last probabl whole life els would possibl wish order came time mention safe pack happi,True,30,175,9,6,4,0.2333333333333333,positive
2,4,excel,True,1,9,0,0,1,0.0,neutral
3,5,great flavour top slow cook,True,9,42,3,2,1,0.3333333333333333,positive
4,5,say,False,6,25,5,0,1,0.0,neutral
5,4,excel item good men,False,4,27,1,1,2,0.7,positive
6,5,thank happi,True,5,25,2,0,3,0.0,neutral
7,5,beauti,True,1,9,0,0,1,0.0,neutral
8,5,alway buy big bottl,True,4,23,0,1,2,0.0,neutral
9,5,alway use product heavili mistreat hair work wonder time time,True,16,90,6,0,1,0.0,neutral
10,5,great valu,True,2,11,0,0,1,0.8,positive
11,5,one pictur get star regular one use awesom peopl dri skin,True,26,130,11,2,5,0.0,neutral
12,5,item describ excel qualiti rapid deliveri great skin irrit red blemish,True,13,99,2,4,2,0.4,positive
13,5,good bodi wash strong smell,True,9,42,4,0,1,0.5666666666666667,positive
14,5,great,True,1,5,0,0,1,0.8,positive
15,5,worth,True,2,9,0,1,1,0.3,positive
16,5,rememb tri friend hous year ago ive use month one ill buy,False,25,123,13,3,4,-0.5,negative
17,5,great,True,1,5,0,0,1,0.8,positive
18,3,best antiperspir unless like go work snow drift arm,True,19,101,10,1,1,1.0,positive
19,5,love product,True,3,17,1,0,1,0.5,positive
20,5,die eat one u die content man love u em,False,16,80,7,3,4,0.5,positive
21,5,love rang bodi lotion u greasi easi appli soak quickli leav skin feel super soft moisturis great valu money scent fresh light great go beauti essenti bathroom cupboard review collect part promot,False,58,317,25,8,3,0.46190476190476193,positive
22,5,suffer dri sensit skin vaselin one product make skin flare itch like crazi first thing notic beauti fresh smell escap lift cap appli drop skin instantli felt sooth relief easili moisturis skin absorb effortlessli greasi unlik alot moisturis tri use product everi day improv dri skin condit massiv recommend product enough absolut love review collect part promot,False,108,605,48,10,10,0.2625,positive
23,5,absolut love stuff leav love linger fragranc smell time open wardrob cloth drawer get everyth clean realli well remind kid mum put freshli launder cloth love,True,50,271,21,9,4,0.37333333333333335,positive
24,5,happi,True,4,18,3,0,1,0.0,neutral
25,5,love wash cashmer sweater home save lot money compar take cloth dri cleaner everi week happi purchas,True,32,166,16,3,4,0.5,positive
26,5,prior receiv pretti rough elbow particular skin feel dri busi mum two admit sometim neglect may empathis product trial gave perfect opportun reconnect bit u cme time u day bath shower smother must admit first time put u sure smell u offens u like cucumb smell although u alo tend smell perfum time howev day actual like smell applic went nice thick soak pretti quickli u feel sticki alway morn wash even even bedtim skin feel notic softer rough elbow gone verdict thumb ye continu use thank fab product trial introduc vaselin alo review collect part promot,False,191,1039,88,30,24,0.2016666666666666,positive
27,5,happi item,True,3,15,1,0,1,0.0,neutral
28,5,realli like textur almost like gel realli light easili absorb skin leav feel soft fresh without weight thicker cream would buy review collect part promot,False,50,269,21,9,4,0.26666666666666666,positive
29,5,smell nice,True,2,11,0,0,1,0.6,positive
30,5,great deal tresem shampoo give long last suppli need keep buy good price,True,23,120,9,1,2,0.3625,positive
31,5,great valu,True,2,11,0,0,1,0.8,positive
32,5,love comfort,True,3,17,1,0,1,0.5,positive
33,1,horribl,False,1,9,0,1,1,0.0,neutral
34,5,great buy,True,3,11,1,0,0,0.8,positive
35,3,love contain easi pour refil nother automat liquid futur thick gloopi hard econom scent smell like wear wash may love rins,True,52,268,26,10,4,0.10208333333333332,positive
36,5,wash shark well,True,3,18,0,0,1,0.0,neutral
37,5,excel,True,1,9,0,0,0,0.0,neutral
38,5,good pleasant smell deoder boy love christma,True,10,64,3,1,1,0.6444444444444444,positive
39,4,deliv quickli decent shampoo star one bottl leak deliv,True,15,90,5,1,0,0.16666666666666666,positive
40,5,use lot make brand past bought expens make remov product none ever remov mascara eye shadow foundat base etc gentli well simpl cleans lotion consist runni squeez bottl appropri onto cotton wool ideal control much dispens also great tidi eyelin mascara error appli spars cotton wool bud alway keep bathroom cabinet pay,False,90,529,38,13,8,0.17,positive
41,5,sure big jar cost doubl size though,False,13,65,6,1,0,0.25,positive
42,5,got offer cloth come soft smell great last long time genuin well,True,27,135,12,5,3,0.2125,positive
43,5,amaz buy last month smelt amaz neighbour even ask buy one,True,22,111,10,4,2,0.0,neutral
44,5,great buy smell gorgeou,True,4,26,0,1,1,0.8,positive
45,5,textur like use bath shower,True,4,34,1,2,1,0.0,neutral
46,5,share famili,True,3,18,1,0,0,0.0,neutral
47,5,love even better deal,True,11,47,6,0,2,0.5,positive
48,5,great product,True,2,14,0,1,1,0.8,positive
49,4,bought item give gift advertis dove moisturis deepli nourish bodi wash receiv dove idratant bagnodoccia di belleza languag cannot read even less distinct fragranc,True,35,213,11,4,11,0.06666666666666667,positive
50,4,good price nice smell overpow leav white powderi mess like anti perspir happi,True,18,116,3,4,4,0.28124999999999994,positive
51,5,good wipe good buy,True,4,20,0,1,1,0.7,positive
52,5,nice fragranc seem last cloth,True,10,51,5,1,1,0.3,positive
53,5,use tresemm product year previous regular heat protect recommend one colour treat hair gave go ive look back leav hair love shine ive got dy red hair hard keep look healthi seem good job heat protect dri hair straighten tong seem keep damag away,False,78,412,32,7,8,0.10595238095238095,positive
54,5,much cheaper boot great valu,True,8,45,3,4,3,0.5,positive
55,2,like blue version overpow aw smell bin,False,18,90,11,2,1,0.0,neutral
56,5,like use one regular wash everyth come clean use two load kg wash lot white wash give extra boost machin use water cycl good valu money buy pack three regular purchas,True,67,314,33,6,6,0.17777777777777778,positive
57,5,excel valu hav carri,True,9,45,5,1,1,0.0,neutral
58,5,wash,True,1,7,0,0,1,0.0,neutral
59,5,love fresh smell,True,3,18,0,0,1,0.4,positive
60,5,great item,True,2,10,0,0,0,0.8,positive
61,5,like noodl tast like spare rib,True,10,54,3,0,2,0.0,neutral
62,5,good deodor easili irrit skin like dove soap seem irrit dri skin use dove soap quit long time certainli someth good seem good main sell point beyond effect hour deodor prone mark cloth certainli seem work far goe though abl test everi singl colour good though recommend,False,101,530,49,16,9,0.4309523809523809,positive
63,5,great bodi wash cheap fast deliveri,True,7,40,1,1,2,0.46666666666666673,positive
64,1,yet tri tast day age start produc perfect glass bottl suddenli plastic,False,23,121,10,3,0,1.0,positive
65,1,even worth one star bring lot white stuff high expect product total failur wast,True,24,125,10,3,2,0.11499999999999999,positive
66,5,bought step dad,True,6,27,3,0,1,0.0,neutral
67,5,love oh smell good hate year still everyon els,True,23,99,14,1,5,0.1333333333333333,positive
68,5,great gift,True,2,10,0,0,1,0.8,positive
69,5,classic know hellman mayo cap stay much cleaner jar tast great everyth,False,23,124,11,3,15,0.3888888888888889,positive
70,5,cool,True,1,4,0,0,1,0.35,positive
71,5,absolut great moistur dri skin complain smell great skin like coca butter smell,True,21,121,7,3,4,0.8,positive
72,5,great packag buy,True,3,17,0,0,1,0.8,positive
73,5,work well truli invis,True,5,30,1,0,1,0.0,neutral
74,3,nice cost effect,True,4,23,1,0,1,0.6,positive
75,5,great,True,1,5,0,0,1,0.8,positive
76,5,exactli say kitchen sink alway get block sinc put block last month,True,29,144,16,0,2,0.0,neutral
77,4,favourit scent intens rang smell love last age cloth use recommend amount otherwis scent strong definit wash probabl half,False,41,236,18,5,4,0.19166666666666668,positive
78,5,find best laundri part includ use one dose like liquid powder smell great wash well,False,35,167,19,3,2,0.9,positive
79,5,calori realli big portion,False,9,47,4,0,1,0.0,neutral
80,4,cream easi appli feel extremli cool doesnt dri kind sticki feel littl scent fact frangranc fairli neutral good cream spread soak easili review collect part promot,False,59,303,31,6,5,0.5499999999999999,positive
81,5,execel product made skin feel silki smooth extrem hydrat use coupl week skin felt healthier hydrat overal look better would definit recommend product friend review collect part promot,False,46,278,17,8,4,0.45,positive
82,4,cream light odourless leav skin feel genuin smooth suppl refresh use part nightli routin appli go bed wash dri face light enough clog pore feel sticki face morn face alway feel smooth replenish also tri use cream daytim benefit describ u long last enough term hydrat give mean often feel need reappli hour great overnight moisturis sensit skin u unscent u realli gentl sore patch review collect part promot,False,136,761,63,20,6,0.20375000000000001,positive
83,5,fresh clean reliabl deliveri,True,5,34,1,1,2,0.33333333333333337,positive
84,5,great combin start use yo born still use,True,15,79,7,1,1,0.8,positive
85,5,nice fresh smell product,True,5,32,1,0,1,0.44999999999999996,positive
86,5,crave thing transport us back innoc time bovril one thing gooey unctuous tar black bovril overflow spoon ding ding ding stir hot water make dissolv earthi beefi smell hint celeri good know els sometim get alcohol fatigu bovril great altern nightcap even mug tea even go far dissolv pat butter extra rich within hour pretti much knock sleep soundli morn warm comfort pack last long time sure certainli winter,True,132,681,61,12,10,0.2544871794871795,positive
87,5,love bought cheaper home bargain,True,10,52,4,2,1,0.5,positive
88,1,item damag unabl pour without spillag transfer anoth bottl unabl wait replac,True,20,124,8,3,1,0.0,neutral
89,5,good price,True,2,11,0,1,1,0.7,positive
90,5,came fast,True,4,18,2,1,1,0.2,positive
91,5,hi simpl absolut must facial moisturis cannot find uk store anywher discontinu product pleas,False,25,157,10,7,8,0.0,neutral
92,1,pleas go back old capsul new one make household suffer terribl allerg reaction constant hay fever,False,23,128,5,3,1,0.05909090909090909,positive
93,4,never usual use laundri soften pleasantli surpris result product cloth smelt great smell last despit children best effort cloth came much softer think convert,False,39,239,15,4,5,0.425,positive
94,5,marmit lover switch back glass jar marmit right consist squeez glass jar recycl,False,31,159,16,5,2,0.14285714285714285,positive
95,5,great,True,1,5,0,0,1,0.8,positive
96,5,thank,True,2,9,1,0,1,0.0,neutral
97,5,got great buy put much wash clean cloth end fragranc last long time,True,29,135,14,1,4,0.2633333333333333,positive
98,5,lure entic fragranc condition notic eye would smart kid would ask seem squint eye back use comfort pure use reaction smell good soften cloth complain,False,53,286,26,7,7,0.28214285714285714,positive
99,5,give good result fragranc strong though last long time realli like realli abl still use product avoid,False,41,198,20,4,4,0.2708333333333333,positive
100,5,good,True,1,4,0,0,1,0.7,positive
101,5,good size spray,True,3,15,0,0,1,0.7,positive
102,5,price bulk pack less buy item individu somewher els use shampoo tend dri hair like use lot chemic product perfect contain noth keep dandruff free even anti dandruff shampoo alway work found past,True,62,343,29,9,6,0.24583333333333335,positive
103,5,like make soup casserol product well,True,15,77,7,3,2,0.0,neutral
104,5,best ice cream ever,False,5,23,1,0,1,1.0,positive
105,5,live extrem hard water area half year soon hair becom dri scalp sensit great shampoo husband complet satisfi,False,37,194,18,7,5,0.11950757575757576,positive
106,5,easi use recommend want get glam go somewher product use,True,25,110,15,1,2,0.0,neutral
107,1,disappoint show big condition small arriv,True,7,52,1,0,1,-0.125,negative
108,5,know work,True,6,26,4,0,1,0.0,neutral
109,3,clean cloth well mani cloth smell good wise price good,True,22,115,10,0,3,0.6166666666666667,positive
110,5,would recommend good valu,True,6,30,1,1,1,0.7,positive
111,5,buy thank,True,6,28,4,0,1,0.0,neutral
112,5,say,True,6,25,5,0,1,0.0,neutral
113,5,alway fan dove product antiperspir effect last longer product ever use realli gentl skin keep fresh day long,True,30,171,10,4,4,0.08333333333333333,positive
114,5,expect repeat purchas,True,5,29,1,1,1,0.0,neutral
115,5,excel valu money,True,4,25,1,0,1,0.0,neutral
116,5,excel clean good valu,True,4,31,0,2,2,0.5333333333333333,positive
117,5,happi,True,4,18,3,0,1,0.0,neutral
118,5,excel valu,True,2,15,0,0,1,0.0,neutral
119,5,great valu shampoo,False,3,19,0,0,2,0.8,positive
120,5,exactli wat say box amazon deal less money spent,True,16,74,7,1,1,-0.13333333333333333,negative
121,1,exact similar litr one costco thick smelt love similar regular size one supermarket think larg quantiti issu one amazon runni dilut smell soften cloth may fake think realli curiou bad batch amazon sourc genuin product baffl,True,74,413,30,5,14,-0.09374999999999999,negative
122,5,amaz offer price resist,True,5,37,1,3,2,0.0,neutral
123,1,hand realli dri bleed due eczema handwash dosent dri hand make bleed,False,29,141,17,1,1,-0.125,negative
124,5,issu say,True,6,28,4,1,1,0.0,neutral
125,5,need say use time soup risotto,True,13,62,6,2,3,0.0,neutral
126,5,simpli love deodrant scent great fresh sporti use week never problem never leav white mark cloth,False,37,185,19,5,4,0.4,positive
127,5,thicken gravi realli well add wonder flavour,False,9,53,2,0,1,0.0,neutral
128,5,amaz great price,True,5,27,2,0,1,0.8,positive
129,4,smell great easi one hand applic,True,6,41,0,1,1,0.8,positive
130,5,good valu would recommend,True,6,34,2,1,2,0.7,positive
131,5,bodi deodor love smell great valu money,False,11,59,4,1,1,0.65,positive
132,5,floor cleaner use smell good home feel refresh use,True,17,84,8,1,3,0.7,positive
133,5,btilliant buy,True,2,13,0,0,1,0.0,neutral
134,5,valu money,True,3,15,1,0,1,0.0,neutral
135,5,fabric condition work less one smell divin last,True,18,96,8,2,1,-0.08333333333333333,negative
136,2,find shop bought line thought fake brand smell similar quit africa poorer product sinc new label,False,27,163,11,5,4,-0.12121212121212122,negative
137,2,use year happi last can nozzl block within week cant clear hot water bit disappoint,False,27,141,10,4,3,0.11666666666666668,positive
138,1,buy year content good howev bottl aw three time cut right fingernail open also turn upsid approach empti due ridicul design bottl,False,48,268,25,8,5,0.2151785714285714,positive
139,5,pleasant use littl scent want shower gel brilliant nasti chemic smell super clean design great whole famili young old simpl product skin friendli mean perfum colour honestli say product leav skin irrit sensit problemat skin prone dermat stuff could use face wash gentl review collect part promot,False,91,523,43,19,9,0.35787037037037034,positive
140,5,wipe great get stubborn make love fact wipe infus miner plant extract use ther irrit sting face feel smooth refresh review collect part promot,False,50,282,24,7,3,0.5666666666666668,positive
141,5,great qualiti wipe strong use tear apart like wipe must buy brand name purchas near futur satisfi simpl product line review collect part promot,False,46,257,20,8,5,0.4444444444444445,positive
142,5,love face wipe great job remov make left skin feel squeaki clean ad bonu absenc strong smell feel product left skin love review collect part promot,False,54,273,26,6,4,0.37142857142857144,positive
143,4,sensit skin work realli well took make easili u irrit skin felt realli refresh would definit purchas futur use would recommend product review collect part promot,False,46,278,19,9,5,0.0,neutral
144,5,use month realli pleas work get make easili smell nice wet leav skin moisturis silki clean irrit defient new favourit make remov review collect part promot,False,48,261,21,3,7,0.25075757575757573,positive
145,4,tri test skin quench night cream light soft textur appli night soak skin make fell soft would recommend product friend famili work wonder review collect part promot,False,51,281,22,7,3,0.19999999999999998,positive
146,4,happi product light skin sensit would recommend appli much wish day u feel bad come easi use plastic tub easi screw top review collect part promot,False,53,274,25,8,6,0.10000000000000006,positive
147,4,great water base moisturis light skin give dewi complexion sinc use product twice day notic signific improv skin elast skin tone review collect part promot,False,51,281,25,7,5,0.13333333333333333,positive
148,5,anoth great product simpl ever stop make pleas,False,14,82,5,6,3,0.8,positive
149,5,good flavor,True,2,11,0,0,0,0.7,positive
150,5,great,True,1,5,0,0,0,0.8,positive
151,5,question say bottl,True,8,36,5,0,1,0.0,neutral
152,4,good valu favourit condition,True,6,42,2,2,2,0.7,positive
153,5,love smell,True,2,12,0,0,0,0.5,positive
154,3,love product howev hard spray would recommend though,True,11,70,2,3,3,0.10416666666666666,positive
155,5,got tri wasnt disappoint littl less thick condition market make go also notic tray doesnt get mucki afterward cloth soft love subtl scent still use larg bottl go long way,False,58,302,27,4,4,0.01666666666666666,positive
156,5,littl goe long way,False,6,24,2,0,1,-0.05,negative
157,2,convinc smell match origin seem less thick previou descript refer batteri review show verifi purchas none name,True,28,178,10,5,5,-0.23333333333333334,negative
158,5,great soap wife love actual moistur skin everytim use,True,21,106,10,3,3,0.43333333333333335,positive
159,5,love soap clean well keep hand moist good peopl eczema,True,15,84,5,2,2,0.5222222222222223,positive
160,5,definit worth money laundri often last month definit buy,True,21,116,11,3,3,0.15,positive
161,5,arriv super fast two good size bottl dont know peopl moan review size fabric soften ultra concentr dont need use full cap last long enough fabric soften also smell great,True,49,265,19,6,4,0.2916666666666667,positive
162,5,great product happi,True,6,32,3,0,1,0.8,positive
163,5,great price purchas still price would subscrib buy,True,19,95,9,2,3,0.8,positive
164,5,love smell pour smaller bottl make use manag beat,True,17,97,6,4,3,0.25,positive
165,5,pod work well use great valu three bag bought,True,20,96,9,3,3,0.8,positive
166,5,love comfort pure children sensit skin irrit like soften done past scent also pleasant overpow,False,32,183,17,3,5,0.2994047619047619,positive
167,5,thank,True,1,6,0,0,1,0.0,neutral
168,5,bit wateri,True,2,10,0,0,1,0.0,neutral
169,5,good,True,1,4,0,0,1,0.7,positive
170,2,blue bottl alot better smell less blue bottl cloth hang outsid wash line small anyth,False,24,138,8,2,2,0.016666666666666673,positive
171,5,great valu money smell nice seem stop hair static day use,True,18,87,7,1,2,0.6333333333333333,positive
172,3,good product,True,2,12,0,0,1,0.7,positive
173,2,product arriv broken spilt insid envelop,True,13,73,7,1,1,-0.4,negative
174,2,squirt well,False,5,24,3,0,0,0.0,neutral
175,5,good valu amount capsul get packet good price,True,18,85,10,0,1,0.7,positive
176,5,bit runni thick liquid ok,True,10,49,5,2,1,0.09999999999999998,positive
177,5,work great,True,2,11,0,0,1,0.8,positive
178,1,use simpl rich moisturis year need find altern new formula burn skin real shame loyal custom switch inform explan provid manufactur,False,42,240,21,5,5,0.2611742424242424,positive
179,5,excel valu money,True,4,25,1,0,0,0.0,neutral
180,5,great buy,True,7,33,4,2,2,0.8,positive
181,3,person tast sold mine,True,7,40,1,3,2,0.0,neutral
182,5,three flavour good,False,8,37,5,0,1,0.7,positive
183,5,tri mani english mustard time alway come back colman sunday roast take tube invari serv inferior one,False,38,179,21,2,8,0.0,neutral
184,5,titl suggest realli wont buy tea bag pg tip good strong flavour like strong tea get realli good cup tea bag overli packag like never problem damag tea bag other mention continu buy stapl,False,63,321,29,9,10,0.42833333333333334,positive
185,5,bleach bleachi bleach bleach,False,6,38,2,2,2,0.0,neutral
186,4,buy shampoo husband shave head everi week year doesnt requir expens shampoo fragranc love complaint product lather well clean head tini bit hair perfectli nice packag realli cant go wrong,False,57,320,26,8,6,0.1333333333333333,positive
187,5,dove deodor stick best deodor ever use goe love smell amaz leav feel dri confid smell fresh day long love product star highli recommend,False,41,225,16,5,5,0.45,positive
188,5,great qualiti,True,2,13,0,0,1,0.8,positive
189,5,buy amazon prime order problem,True,11,53,6,1,1,0.0,neutral
190,5,great product love scent last age,True,7,43,1,3,2,0.43333333333333335,positive
191,5,,True,1,2,0,1,1,0.0,neutral
192,5,wash cloth nice,True,3,19,0,0,1,0.6,positive
193,5,great tast add depth flavour meal importantli famili gluten free,True,20,108,9,2,2,0.6000000000000001,positive
194,1,year ago use love pot noodl student yuck add addit sauc even pasta tast like carboard situat recent access kettl chose mugshot big mistak,True,49,260,26,9,5,0.16666666666666666,positive
195,1,like product bottl unsuit plastic thin good thing mean almost imposs pick bottl fill small cap without spill signific amount especi bottl still rel full buy happi decant content sturdier bottl,False,66,363,34,8,4,0.01749999999999998,positive
196,5,love lynx product happi buy write review femal like scent men product think scent stay longer skin nice consist lose hand plughol,False,50,242,28,4,5,0.55,positive
197,5,perfect,True,1,7,0,0,0,1.0,positive
198,5,great product great price,True,4,26,0,1,2,0.8,positive
199,5,last forev work well chang anoth brand smell pretti neutral,True,17,96,7,3,3,0.0,neutral
200,5,goo,True,1,4,0,0,1,0.0,neutral
201,5,consider friend brought dinner parti vegan enjoy turn everybodi love even dairi version delici flavour less heavi textur realli good vanilla ice cream,False,42,244,18,3,2,0.35833333333333334,positive
202,2,product fine struggl get smooth thin lid time wet hand imposs also design make difficult hold pour bottl buy,False,36,189,16,7,6,-0.03666666666666667,negative
203,5,alway buy product love qualiti product smell nice leav mark cloth,False,20,113,8,9,3,0.55,positive
204,5,love product keep hair protect,True,9,48,4,1,2,0.5,positive
205,5,happi item,True,3,15,1,0,1,0.0,neutral
206,5,brilliant product left drain clear clean,False,8,50,2,1,2,0.3416666666666667,positive
207,5,great valu,True,2,11,0,0,1,0.8,positive
208,5,fine,True,1,4,0,0,1,0.4166666666666667,positive
209,3,v bought load offer use wash half cap small much good sens smell way descript say put drop like wtf need cap full think wash,False,53,244,24,10,8,0.02666666666666666,positive
210,5,bulk bought drive heavi carri supermarket scent good suppos last wash use half lidful like throw full cap last long,False,48,236,27,8,4,0.13888888888888887,positive
211,4,quit solid product find easier use contain place warm water minut use,True,24,117,12,2,2,0.3,positive
212,5,good alround thank,True,3,19,0,0,3,0.7,positive
213,5,pouch arriv persil box brown box safe packag good wash capsul easi use,True,20,103,6,2,1,0.6,positive
214,5,fantast price mother law love great product,True,9,63,2,4,2,0.65,positive
215,5,well worth,False,3,13,1,0,1,0.3,positive
216,1,seem genuin brand came product smell liquid usual consist comfort buy,True,26,152,14,10,10,-0.25,negative
217,3,idea claim wash,True,8,39,4,2,1,0.0,neutral
218,4,like product,True,2,12,0,0,1,0.0,neutral
219,5,get live dead handi,True,11,51,6,0,3,-0.03181818181818183,negative
220,5,love smell,True,3,15,1,0,1,0.5,positive
221,5,smell good expens,True,5,29,2,0,0,0.7,positive
222,4,good,True,1,4,0,0,1,0.7,positive
223,5,love use past coupl year recent bought amazon found whole lot cheaper boot also use tame hair dri along protect heat,True,49,232,26,4,6,0.04666666666666667,positive
224,5,good valu money,True,4,20,1,0,1,0.7,positive
225,1,know anyon like smell tast like weed vinegar,False,13,79,4,3,2,0.0,neutral
226,2,struggl open lid spill everi time tri use cap measur terribl design product itsel fine would avoid buy irrit lid,False,36,189,16,5,4,0.20833333333333334,positive
227,1,use mani year problem differ product itch bought differ shop still itchi product buy anymor,False,37,195,22,4,3,0.0,neutral
228,5,bought week ago tri mani differ tan product best come across leav skin feel moisturis soft nice natur tan streak definit recommend product,False,41,236,17,4,4,0.5666666666666668,positive
229,4,good valu money contain make difficult pour without spill,True,15,87,6,1,1,0.09999999999999998,positive
230,2,never buy capsul stuck togeth leak make unus cancel subscript,True,20,128,8,2,3,0.0,neutral
231,4,good clean product kid sensit skin,True,10,58,4,0,1,0.5333333333333333,positive
232,5,nice mustard smooth tasti,False,7,33,2,1,1,0.5,positive
233,5,great,False,1,5,0,0,1,0.8,positive
234,3,price rate nephew want christma use,True,17,97,11,4,3,0.0,neutral
235,5,your look super moistur bodi wash leav skin super soft,False,17,90,6,2,2,0.25555555555555554,positive
236,5,love bodi skin get super dri winter product help reduc fyi skin,False,20,97,8,0,4,0.41666666666666663,positive
237,5,use kid sensit skin doesnt irrit us great last scent littl bit goe long way bottl last price reason compar similar product,False,48,247,25,7,5,0.15,positive
238,4,bodi wash soft origin dove origin smell love prefer smell cucumb green tea deep mostur bodi wash mean definetli work great product mostureris prefer one still recommend good product,False,53,282,21,10,7,0.22678571428571428,positive
